{
  "schema_version": "agent_joint_forecast_report_v5",
  "report_mode": "joint_forecast_live",
  "truth_accessed": false,
  "neo4j_query_mode": "live_neo4j",
  "case_id": "20200501_00",
  "region_id": "SA-09",
  "hazard": "heavy_rain",
  "focus_lead_time_hours": 48,
  "selected_joint_rule": "joint_rain_v2_base_kg_persistence_ratio0p25_support1_windows3",
  "base_risk_level": "low",
  "knowledge_triggered": true,
  "joint_final_risk_level": "medium",
  "development_gate_passed": true,
  "operating_status": "research_candidate",
  "formal_warning_allowed": false,
  "generation_mode": "openai_luna",
  "executive_summary_zh": "本次为SA-09暴雨研究候选联合预测，基础方法在24/48/72小时均为低风险；图谱通过跨窗口持续性触发，在三个位点均将联合最终风险确定为中风险。风险演变表现为24小时已有联合信号、48小时主支持比例升至0.57966504、72小时仍保持中风险但支持数降至1，提示信号具有持续性，同时远期证据组合较弱。开发门槛已通过，但正式预警不允许；该结果仅用于研究，不代表生产验证或事后效果结论。",
  "timeline_analysis": [
    {
      "lead_time_hours": 24,
      "base_risk_level": "low",
      "knowledge_triggered": true,
      "joint_final_risk_level": "medium",
      "signal_analysis_zh": "24小时窗口中，v2_base基础风险为低；图谱以cross_window_persistence模式触发，primary_ratio为0.302582、support_count为2.0，按锁定联合规则形成中风险联合结果。该窗口显示已有持续性信号，但比例低于48小时窗口，证据强度解释应保持克制。"
    },
    {
      "lead_time_hours": 48,
      "base_risk_level": "low",
      "knowledge_triggered": true,
      "joint_final_risk_level": "medium",
      "signal_analysis_zh": "48小时窗口中，基础风险仍为低；图谱持续性触发，primary_ratio为0.57966504、support_count为2.0。相较24小时，主支持比例上升且支持数不变，构成三个位点中相对更充分的联合证据；联合最终风险按锁定结果为中风险，不能进一步升级。"
    },
    {
      "lead_time_hours": 72,
      "base_risk_level": "low",
      "knowledge_triggered": true,
      "joint_final_risk_level": "medium",
      "signal_analysis_zh": "72小时窗口中，基础风险仍为低；图谱持续性继续触发，primary_ratio为0.5287658399999999，但support_count降为1.0。主支持比例仍高于24小时，但支持数量减少，说明持续性仍在、证据冗余较弱；联合最终风险保持中风险，不对其作额外升降级。"
    }
  ],
  "spatial_temporal_analysis_zh": "空间上，本次受控预测仅涉及SA-09，不能外推至其他区域。时间上，24小时基础风险为低、联合最终风险为中，表明近期窗口已出现图谱持续性联合信号；48小时主支持比例达到0.57966504且支持数为2.0，是三个位点中证据组合最强的窗口，联合风险仍为中；72小时主支持比例为0.5287658399999999、支持数降为1.0，但跨窗口持续性仍触发，联合风险保持中。整体不是风险等级逐时升级，而是低基础风险在三个预测窗口中被持续的图谱证据稳定映射为中等联合风险；远期窗口的证据冗余下降，应相应提高解释谨慎度。",
  "knowledge_graph_analysis_zh": "Neo4j返回的图谱模式为cross_window_persistence，知识触发状态在24/48/72小时均为true。图谱贡献体现为在基础风险保持低风险的情况下，结合跨窗口持续性和支持计数，将联合最终风险稳定确定为中风险；这不是对基础风险的修改，而是按锁定规则形成联合判定。24小时与48小时support_count均为2.0，72小时为1.0；因此48小时的证据组合相对更充分，72小时虽仍满足联合规则条件，但独立支持较少。开发状态说明新图谱纠错增益只在一个development事件中产生，旧独立集没有纠错触发，故独立纠错增益仍需新的案例验证。",
  "uncertainty_analysis_zh": "主要不确定性来自无真值约束、单case单区域覆盖以及图谱独立纠错增益尚未在新的独立案例中验证。三窗口的联合结果一致为中风险，支持了时间持续性的研究解释；但72小时支持数下降，意味着远期证据组合较不冗余。开发指标虽由工具报告为通过，且控制案例拒绝、事件检测、目标窗口召回和特异性均为1.0，但这些开发事实不能替代生产验证，也不能被解释为本次预测的命中或事后验证。",
  "limitations_zh": [
    "本报告严格处于无真值预测模式，不读取或推测同期观测、灾害影响、新闻、命中、漏报或事后验证。",
    "当前Neo4j返回的受控范围为1个case、1个region和3个预测窗口，不能据此推断更广泛区域或样本上的稳定性。",
    "开发门槛虽已通过，但方法状态为research_candidate，且正式预警不被允许；研究候选不等同于生产验证。",
    "72小时support_count降至1.0，远期联合信号的证据冗余低于24/48小时，存在更高的不确定性。",
    "不得将本次联合风险等级解释为已发生灾害或已被观测证实的结果。"
  ],
  "recommended_actions_zh": [
    "将本结果作为研究候选信号，围绕48小时窗口优先开展内部复核和资源准备，不发布正式预警。",
    "针对24至72小时均存在的跨窗口持续性，进行滚动监测与窗口间一致性检查；不得将其写成同期观测确认。",
    "对72小时信号采用更审慎的研究级跟踪，因为其support_count为1.0，证据冗余较低。",
    "在新增案例和独立对照数据完成前，不应宣称图谱带来已验证的独立纠错增益。",
    "保持预测锁定、选择锁定和无真值约束，禁止人工升级或降级基础风险、图谱触发状态及联合最终风险。"
  ],
  "provenance_summary_zh": "本报告使用正在运行的Neo4j实时查询，query_mode为live_neo4j。预测锁定哈希为291caf4875825aa0f27dc5a291c4af1cb5319117fed158b14d0643471497c536；选择锁定哈希为8d3526d9f6528378d274129ad424cba39904a5cfcce2e164fc62fe7b4ca55545。Neo4j运行命名空间为20260719_rain_full_agent，查询覆盖本case的24/48/72小时三个窗口；未访问真值。"
}
