{
  "schema_version": "agent_joint_forecast_report_v5",
  "report_mode": "joint_forecast_live",
  "truth_accessed": false,
  "neo4j_query_mode": "live_neo4j",
  "case_id": "20200729_00",
  "region_id": "SA-04",
  "hazard": "heatwave",
  "focus_lead_time_hours": 48,
  "selected_joint_rule": "joint_heat_pooled_median_loco_kg_temporal_or_spatial_margin1p0_windows3_maxmargin0p0",
  "base_risk_level": "high",
  "knowledge_triggered": false,
  "joint_final_risk_level": "high",
  "development_gate_passed": false,
  "operating_status": "research_only_blocked",
  "formal_warning_allowed": false,
  "generation_mode": "openai_terra",
  "executive_summary_zh": "SA-04热浪个案（20200729_00）的联合预测在48小时焦点窗口为高风险；24/48/72小时序列呈现“中—高—高”的风险抬升并维持格局。图谱在全部窗口均未触发，因此联合最终风险与基础风险一致。该结果仅限历史迁移研究回放和研究候选分析：高温方法处于research_only_blocked状态，禁止作为正式预警发布。",
  "timeline_analysis": [
    {
      "lead_time_hours": 24,
      "base_risk_level": "medium",
      "knowledge_triggered": false,
      "joint_final_risk_level": "medium",
      "signal_analysis_zh": "24小时窗口基础风险为medium，图谱未触发，联合最终风险保持medium。候选最高气温48.8784°C高于热日阈值47.249969°C；这是预测特征信号，不构成现实观测或正式预警依据。"
    },
    {
      "lead_time_hours": 48,
      "base_risk_level": "high",
      "knowledge_triggered": false,
      "joint_final_risk_level": "high",
      "signal_analysis_zh": "48小时窗口基础风险为high，图谱未触发，联合最终风险保持high。候选最高气温50.505766°C，为三个窗口中的最高预测特征值，体现相对24小时窗口的风险抬升；仅用于研究性预测分析。"
    },
    {
      "lead_time_hours": 72,
      "base_risk_level": "high",
      "knowledge_triggered": false,
      "joint_final_risk_level": "high",
      "signal_analysis_zh": "72小时窗口基础风险为high，图谱未触发，联合最终风险保持high。候选最高气温50.005681°C较48小时窗口略低但仍高于热日阈值47.249969°C，锁定预测分级因此维持高风险；未访问任何事后信息。"
    }
  ],
  "spatial_temporal_analysis_zh": "实时Neo4j时间线显示：24小时窗口为中风险，候选最高气温48.8784°C，高于热日阈值47.249969°C；48小时窗口升为高风险，候选最高气温50.505766°C；72小时窗口仍为高风险，候选最高气温50.005681°C。因而，模型信号从24小时的中等级增强至48小时的高等级，并在72小时虽较48小时候选值略低、但仍维持高等级。该演变仅描述锁定预测特征及其分级，不代表同期实际天气或影响。",
  "knowledge_graph_analysis_zh": "采用规则joint_heat_pooled_median_loco_kg_temporal_or_spatial_margin1p0_windows3_maxmargin0p0，图谱模式为temporal_or_spatial；Neo4j返回的24、48、72小时窗口均为knowledge_triggered=false。因此图谱未提供触发性纠偏、升级或降级，联合结果完全保持各窗口基础方法的原始分级。图谱贡献应解读为本次未满足该规则的时空触发条件，而非图谱已证实或排除任何现实影响。",
  "uncertainty_analysis_zh": "预测不确定性主要来自方法运行边界而非风险等级可被重新裁量：development gate未通过，政策原因是development特异度和对照拒绝未通过、独立划分缺少对照。开发指标中，对照案例拒绝比例为0.8571428571428571、事件案例检出比例为0.6666666666666666、observed_hot_day_recall为0.6428571428571429、observed_nonhot_day_specificity为0.6521739130434783；这些开发阶段指标不能转化为本次预测的事后表现。又因图谱未触发，缺少本案图谱独立修正证据。故应以误报控制、独立对照补充和新案例验证为先，不得将高风险分级升级为正式业务预警。",
  "limitations_zh": [
    "无真值预测模式：未读取、未推测同期观测、灾害影响、新闻、命中、漏报或事后验证。",
    "development特异度和对照拒绝未通过，独立划分缺少对照；高温运行状态为research_only_blocked。",
    "图谱在三个预报窗口均未触发，无法在本个案中展示独立图谱纠错增益。",
    "当前产物是历史迁移研究回放，不是正式业务预警；风险等级不得据此作业务发布。"
  ],
  "recommended_actions_zh": [
    "研究处置：将24/48/72小时“中—高—高”序列保留为受锁定预测输出，供方法审查与后续独立案例评估使用。",
    "误报控制：由于research_only_blocked且独立对照不足，不制作、不转发、也不表述为正式高温预警；避免以模型高风险分级替代业务发布决策。",
    "验证优先：补充新的独立事件与非事件对照案例，重点检验特异度、对照拒绝和图谱在触发/未触发条件下的独立纠错增益。",
    "治理追溯：持续保留预测锁、选择锁及实时Neo4j查询溯源，并在不访问真值的前提下复核窗口分级一致性。"
  ],
  "provenance_summary_zh": "时间线来自正在运行的Neo4j实时查询（live_neo4j），覆盖1个个案、2个区域和6个窗口记录；预测锁定文件为handoff/model_selection/joint_v2/locked_joint_heatwave_predictions.csv，SHA-256为42ffbc31f74ddefeb964cb05d64dc5e288bff4e011e280af19fed16cab092704。规则选择另由manifests/joint_pipeline_selection_lock_v2.json锁定，SHA-256为8d3526d9f6528378d274129ad424cba39904a5cfcce2e164fc62fe7b4ca55545。"
}
